{
  "data_source": "SIMULATED",
  "description": "Qualitative nanopore-like stress profile: indel-dominated, homopolymer-sensitive, uneven coverage, lower quality, reads on both strands.",
  "evidence_class": "SIMULATED",
  "name": "nanopore-like",
  "note": "Synthetic stress profile; parameters are not fitted to any measured platform.",
  "provenance": {
    "converted_from": {
      "file": "nanopore-like.json",
      "schema": "vnx.channel-model/0",
      "sha256": "c33c6cbb989f7177d0c58e11989add86aec6fc30109baf368f888da5d2972e0e"
    },
    "datasets": [],
    "derived": [],
    "fitter": null,
    "references": []
  },
  "schema": "vnx.channel-model/1",
  "stages": {
    "amplification": {
      "cycles": 0,
      "duplicate_rate": 0.0,
      "efficiency_sigma": 0.0,
      "gc_bias": {
        "optimum": 0.5,
        "strength": 0.0
      },
      "substitution_per_cycle": {
        "from_multipliers": null,
        "matrix": null,
        "rate": 0.0
      }
    },
    "sequencing": {
      "bursts": {
        "max_length": 6,
        "rate": 0.005
      },
      "coverage": {
        "dispersion": 4.0,
        "mean": 15.0,
        "model": "negative-binomial",
        "sigma": 0.0
      },
      "deletion": {
        "rate": 0.03,
        "run_length": {
          "distribution": "single",
          "mean": 1.0
        }
      },
      "duplicate_rate": 0.0,
      "homopolymer": {
        "indel_multiplier": 3.0,
        "min_run": 3,
        "substitution_multiplier": 1.5
      },
      "insertion": {
        "base_weights": null,
        "rate": 0.01
      },
      "missing_read_rate": 0.0,
      "n_rate": 0.001,
      "position_profile": null,
      "quality": {
        "correct": 15,
        "error": 7,
        "informative": 0.5,
        "position_slope": 0.0,
        "sd": 0.0
      },
      "read_length": {
        "max_length": null,
        "min_fraction": 0.5,
        "truncation_rate": 0.0
      },
      "reverse_complement_rate": 0.5,
      "shuffle_window": 0,
      "substitution": {
        "from_multipliers": null,
        "matrix": null,
        "rate": 0.02
      }
    },
    "storage": {
      "breakage_rate": 0.0,
      "contamination_rate": 0.0,
      "damage": {
        "from_multipliers": null,
        "matrix": null,
        "rate": 0.0
      },
      "retention": 1.0,
      "strand_loss": {
        "burst_count": 0,
        "burst_length": 0,
        "rate": 0.0
      }
    },
    "synthesis": {
      "deletion": {
        "rate": 0.0,
        "run_length": {
          "distribution": "single",
          "mean": 1.0
        }
      },
      "dropout_rate": 0.0,
      "insertion": {
        "base_weights": null,
        "rate": 0.0
      },
      "molecules_per_strand": 1,
      "position_profile": null,
      "substitution": {
        "from_multipliers": null,
        "matrix": null,
        "rate": 0.0
      },
      "truncation": {
        "min_fraction": 0.5,
        "rate": 0.0
      },
      "yield_sigma": 0.0
    }
  },
  "version": "1.0.0"
}
